ID,Authors,Year,Year_numeric,Decade,Title,Search engine,Classification,Problem_statement,Research_gap,Contribution,Method,Method_clean,Method_category,Method_detail,Study region,Study_region_clean,Study_region_continent,Numerical water value,Has_water_value,DOI,Extraction_source,Notes
1-118,"Maaz, A.; Grote, F.; Moser, A.",2015,2015,2015–2019,Agent-based price simulation of the German wholesale power market,IEEE Xplore,D,Increased renewable energy integration reduces utilization rates of conventional plants and complicates the simulation of realistic spot market price volatility.,Standard marginal cost-based simulations fail to accurately reproduce the price volatility resulting from high renewable energy feed-in and agent bidding.,A simulation approach for realistic spot market prices incorporates agent bidding behavior to capture volatility beyond simple marginal cost calculations.,LP,LP,Optimization,LP,,Not specified,Not specified,,False,10.1109/EEM.2015.7216698,"Intro, Sec 2",
1-120,"Diogo, B.; Sousa, J.; Lagarto, J.",2024,2024,2020–2025,Alternative Price Clearing Mechanisms for the Day-Ahead Electricity Market to Balance Consumers and Producers Outcomes,IEEE Xplore,C,"The current wholesale electricity market pricing mechanism faces significant criticism for its high cost burden on consumers, particularly during global energy crises and volatile periods.",Existing day-ahead markets lack alternative pricing designs that effectively utilize weighted averages of accepted offer prices to distribute costs more fairly among participants. (inferred).,Two alternative electricity pricing mechanisms based on weighted technology-specific offer prices are proposed to decrease the total financial cost burden on the end-use consumers.,Econ-Engi,Econ-Engi,Economic-Engineering,Econ-Engi,,Not specified,Not specified,,False,10.1109/EEM60825.2024.10608995,Abstract,
1-121,"Dhayalini, K.; Deepu, M. S.; Sathiyamoorthy, S.; Christober Asin Rajan, C.",2013,2013,2010–2014,Analysing the economics of wind power based on Locational Marginal Prices using restructured power systems,IEEE Xplore,G,"Wind energy mills are difficult to schedule due to variability and unpredictability, often resulting in transmission congestions and financial losses for producers in competitive power grids.",Precise economic evaluation of wind power requires more detailed derivations of LMPs that account for transmission limits and restructured wholesale market characteristics (inferred).,A MATLAB-based analysis derives LMPs and calculates transmission congestion costs to provide information on the economic conditions of wind power markets for producers and consumers.,Econ-Engi,Econ-Engi,Economic-Engineering,Econ-Engi,,Not specified,Not specified,,False,10.1109/ICCPCT.2013.6528955,"Abstract, Intro",
1-124,"Rosemberg, A. W.; Street, A.; Garcia, J. D.; Valladao, D. M.; Silva, T.; Dowson, O.",2022,2022,2020–2025,Assessing the Cost of Network Simplifications in Long-Term Hydrothermal Dispatch Planning Models,Scopus,R,"Long-term hydrothermal dispatch problems are typically solved using simplified network models that lead to sub-optimal, time-inconsistent policies and dangerous operating points in actual implementation.","No reliable, open-source implementation of the stochastic dynamic programming (then ""SDP"") algorithm existed to assess model-misspecification risk or compare different network formulations.","An open-source tool, HydroPowerModels.jl, implements the SDP algorithm and a fast inconsistency-assessment algorithm to quantify the impact of network simplifications in hydrothermal systems.",SDDP,SDDP,Optimization,SDDP,Synthetic case study,Synthetic/Theoretical,Not applicable,,False,10.1109/TSTE.2021.3106810,"Intro, Contribution, Open-Source Package",
1-126,"Zhang, X.; Zhao, J. H.; Wang, Z.; Dong, Z. Y.",2015,2015,2015–2019,Assessing the feasibility of the interconnected power market in Australia,IEEE Xplore,C,"Isolated electricity markets suffer from higher price volatility and limited reliability, which can be mitigated through transmission interconnectors and coordinated regional market integration. (inferred).",There is a lack of empirical analysis regarding how transnational grid interconnections influence economic surplus and price stabilization in the Australian National Electricity Market. (inferred).,An evaluation framework calculates the economic benefits and price reductions achieved through interconnecting regional electricity markets using high-voltage transmission infrastructure. (inferred).,Econ-Engi,Econ-Engi,Economic-Engineering,Econ-Engi,,Not specified,Not specified,,False,10.1049/ic.2015.0227,"References, Price Plot",
1-127,"Stoenescu, I. B.; Costinas, S.; Deaconu, G. M.",2019,2019,2015–2019,Assessment of Hydropower Plants Energy Production Cost Influenced by Operational Decisions and Control Strategy,IEEE Xplore,G,"Determining the final efficiency surface of hydropower units is complicated by various internal power losses related to friction, core losses, and excitation winding within the generator.",Methodology for determining hydro-generator power losses needs to move beyond simple assessments to more detailed calorimetric methods based on specific international electrotechnical standards (inferred).,A calorimetric method based on IEC 60034-2 standards calculates power losses to accurately determine the hydropower unit final efficiency surface through real CAM combinations.,Econ-Engi,Econ-Engi,Economic-Engineering,Econ-Engi,,Not specified,Not specified,,False,10.1109/CSCS.2019.00062,"Section 2, Refs",
1-128,"Bellenbaum, J.; Weber, C.; Doorman, G.; Farahmand, H.",2018,2018,2015–2019,Balancing Market Integration - Model-Based Analysis of Potential Cross-Border Reserve Exchange Between Norway and Germany,IEEE Xplore,D,Integrating balancing markets across borders requires transmission capacity which incurs opportunity costs when committed reserves are activated instead of spot trades.,Heuristics are needed for estimating future transmission capacity utilization when spot and reserve markets are not co-optimized in advance. (inferred).,A parsimonious optimization model calculates the efficient utilization of transmission capacity for simultaneous spot and reserve exchange between interconnected countries.,LP,LP,Optimization,LP,,Not specified,Not specified,,False,10.1109/EEM.2018.8469856,"Abstract, Sec II",
1-129,"Fujii, Y.; Okamura, T.; Inagaki, K.; Yamaji, K.",2004,2004,2000–2004,Basic analysis of the pricing processes in modeled electricity markets with multi-agent simulation,IEEE Xplore,D,Vertically integrated utilities are transitioning to deregulated markets where pricing processes are complex and determined by multiple decision-making entities.,Existing game theory and reinforcement learning studies have not sufficiently explored the effects of market design on pricing processes.,A multi-agent model utilizes reinforcement learning for agents to autonomously learn bidding strategies through trial-and-error to analyze electricity market price formation.,Other,Other,Other,Other,,Not specified,Not specified,,False,10.1109/DRPT.2004.1338503,"Abstract, Intro",
1-130,"Gebrekiros, Y.; Doorman, G.; Jaehnert, S.; Farahmand, H.",2013,2013,2010–2014,Bidding in the Frequency Restoration Reserves (FRR) market for a Hydropower Unit,IEEE Xplore,A,"Hydropower units must deviate from their nominal, most profitable operation points to provide frequency restoration reserves (FRR), requiring a method to calculate robust bidding prices for these services.",Literature lacked an opportunity cost-based method that utilizes piecewise linear discharge-power relationships to determine bidding prices for both upward and downward FRR capacity provision. (inferred).,"A method uses the piecewise linear characteristics of hydropower units to calculate bidding prices for upward and downward FRR, demonstrating robustness even when service order is changed.",MILP,MILP,Optimization,MILP,,Not specified,Not specified,Yes,True,10.1109/ISGTEurope.2013.6695362,"Intro, Conclusion",
1-131,"Gu, H.; Zhou, Y.; Wang, Y.",2008,2008,2005–2009,Bidding strategies analysis for hydro-thermal power suppliers under different power demand,IEEE Xplore,C,Cascade hydropower stations require complex coordination to optimize water utilization across multiple stations while fulfilling comprehensive utilization requirements and maintaining grid stability. (inferred).,Current bidding models do not adequately consider the minimum time limits of series starting-up or the impacts of cascade hydropower station comprehensive utilization.,A discrete-time evolutionary game model optimizes generator bidding strategies while incorporating hit probabilities and technical constraints for cascade hydropower operations. (inferred).,Econ-Engi,Econ-Engi,Economic-Engineering,Econ-Engi,,Not specified,Not specified,,False,10.1109/CICED.2008.5211675,"Conclusion, References",
1-135,"Ojeda-Esteybar, D. M.; Lopez-Salgado, C. J.; Pringles, R.; Ano, O.; Rubio-Barros, R. G.",2020,2020,2020–2025,Co-optimization in the operation of hydroelectric and solar generation in the province of San Juan: Methodology,IEEE Xplore,R,Hydropower operators must maximize revenues from energy sales while accurately representing non-linear production functions that depend on both turbine flow and variable hydraulic head.,Standard linear programming models overestimate or underestimate produced energy because they linearize production functions without accounting for hydraulic head variations in the reservoir.,A mathematical model using Benders decomposition iterations between a master problem and subproblems to solve the short-term scheduling of reservoirs with non-linear production functions.,NLP,Other,Optimization,NLP,,Not specified,Not specified,,False,10.1109/TDLA47668.2020.9326092,"Intro, Solution Methodology",
1-137,"Binato, S.; Pereira, M.",1995,1995,Pre-2000,Decentralized planning of hydroelectric power systems,IEEE Xplore,R,Restructuring the power sector to allow private enterprise participation requires determining the optimality of decentralized plans versus centralized coordination in developing countries.,Decentralized planning frameworks lacked rigorous assessment of how individual hydro plant generation choices impact national load growth and social investment requirements (inferred).,A coordinating framework evaluates the benefits of interconnected hydrothermal system operations to supply electricity needs while competing with social investments in developing countries.,LP,LP,Optimization,LP,,Not specified,Not specified,,False,10.1109/59.373975,"Intro, References",
1-138,"Ma, O.; Alkadi, N.; Cappers, P.; Denholm, P.; Dudley, J.; Goli, S.; Hummon, M.; Kiliccote, S.; MacDonald, J.; Matson, N.; Olsen, D.; Rose, C.; Sohn, M. D.; Starke, M.; Kirby, B.; O'Malley, M.",2013,2013,2010–2014,Demand Response for Ancillary Services,IEEE Xplore,R,Integrating variable generation like wind and solar increases the need for system flexibility and fast-responding ancillary services that generators may not always provide efficiently.,"Existing literature focuses on peak load management, leaving a gap in understanding the realizable potential and economic value of customer loads providing ancillary services year-round.",A methodology constructs detailed temporal and spatial representations of demand response resources to evaluate their economic value and implementation barriers for ancillary services.,Econ-Engi,Econ-Engi,Economic-Engineering,Econ-Engi,,Not specified,Not specified,,False,10.1109/TSG.2013.2258049,"Abstract, Intro, Methodology",
1-139,"Fernandez, A.; Blumsack, S.; Reed, P.",2012,2012,2010–2014,Evaluating Wind-Following and Ecosystem Services for Hydroelectric Dams in PJM,IEEE Xplore,R,Hydropower operators participating in centralized markets face the decision of when to sell electricity and what type of wind-following service to offer to the market.,"Traditional load-following practices do not specifically optimize the allocation of hydropower capacity for ""wind following"" services within a strategic decision-making framework (inferred).",An optimization-based decision framework allows hydropower generators to allocate capacity to wind-following markets while satisfying monthly energy declarations and reservoir supply constraints.,LP,LP,Optimization,LP,,Not specified,Not specified,,False,10.1109/HICSS.2012.256,"Intro, Decision Framework",
1-145,"Warland, G.; Fosso, O.; Wangensteen, I.; Wolfgang, O.",2005,2005,2005–2009,Efficient transmission pricing in power systems with considerable time-dependency,IEEE Xplore,G,Forecasting point tariffs and managing congestion in hydro-thermal systems is complex due to loop flows in meshed power grids and the time-dependent value of stored water.,Fundamental optimization models for electricity markets often omit detailed power flow constraints and marginal losses necessary for determining dynamic point tariffs in hydro-dominated systems.,An optimization model uses the SDDP technique and linearized power flow equations to forecast dynamic transmission tariffs while maximizing social welfare and minimizing grid losses.,SDP,SDP,Optimization,SDP,,Not specified,Not specified,,False,10.1109/IPEC.2005.206948,"Intro, Methodology",
1-147,"Petrichenko, R.; Baltputnis, K.; Sobolevsky, D.; Sauhats, A.",2018,2018,2015–2019,Estimating the Costs of Operating Reserve Provision by Poundage Hydroelectric Power Plants,IEEE Xplore,F,Hydropower plant owners require fair remuneration for reserve services to recoup investment costs and operational expenses in competitive energy markets.,There is a lack of empirical methods for estimating the specific opportunity costs of providing different operating reserves for cascaded hydropower systems. (inferred).,An optimization model uses real-world data to calculate opportunity costs for spinning and non-spinning reserve provision in a cascaded hydropower system.,NLP,Other,Optimization,NLP,,Not specified,Not specified,,False,10.1109/EEM.2018.8469876,"Intro, Sec II",
1-148,"Aasgard, E. K.; Andersen, G. S.; Fleten, S.; Haugstvedt, D.",2014,2014,2010–2014,Evaluating a Stochastic-Programming-Based Bidding Model for a Multireservoir System,IEEE Xplore,C,Hydropower producers face complex daily tasks in determining optimal price-quantity bids for day-ahead markets while coordinating water releases across multiple interlinked reservoirs under uncertainty.,Existing bidding methodologies often rely on simplified time-series approaches rather than fundamental models that represent complex river systems and long-term water values.,"A stochastic programming model using fundamental price scenarios optimizes day-ahead bidding and reduces undesirable ""odd starts"" by seventeen percent in multi-reservoir systems.",MILP,MILP,Optimization,MILP,,Not specified,Not specified,,False,10.1109/TPWRS.2014.2298311,"Intro, Conclusion",
1-149,"Hammons, T.; Olsen, A.; Gudnundsson, T.",1989,1989,Pre-2000,Feasibility of Iceland/United Kingdom HVDC submarine cable link,IEEE Xplore,R,"The United Kingdom requires additional generating capacity to satisfy growing demand, while Iceland possesses significant economically harnessable hydropower potential that is currently underutilized.",No comprehensive assessment existed for the technical and economic viability of a high-voltage direct current submarine cable link between Iceland and the United Kingdom (inferred).,"A feasibility study addresses market considerations, investment requirements, and technical aspects of a 500MW link to export Icelandic hydropower to British markets.",Econ-Engi,Econ-Engi,Economic-Engineering,Econ-Engi,,Not specified,Not specified,,False,10.1109/60.43244,"Abstract, Intro, Conclusions",
1-151,"Khodadadi, A.; Soder, L.; Amelin, M.",2022,2022,2020–2025,Flexible Stochastic Bilevel Scheduling Strategy in Hydropower Dominated Energy Markets,IEEE Xplore,A,Hydropower operators in the Nordic market face complex optimal planning and operation challenges that involve strategic bidding across multiple discharging segments and market price scenarios.,Methodology for strategic hydropower operation lacked a bilevel optimization framework that effectively handles price-maker behavior and downstream impacts across cascaded plant configurations in a competitive market. (inferred).,"A bilevel optimization model facilitates strategic planning for hydropower plants by simulating interactions between plant generation, reservoir content, and discharging segments under varying price scenarios.",LP,LP,Optimization,LP,,Not specified,Not specified,Yes,True,10.1109/ISGTAsia54193.2022.10003497,Nomenclature,
1-152,"Bermudez, J.",2005,2005,2005–2009,General Comparison and Graphic Representation of Economic Dispatch Solutions,IEEE Xplore,C,"Market participants and students struggle to understand the variations in economic dispatch solutions between monopoly, oligopoly, and perfect market environments for hydrothermal coordination.",Scientific literature often lacks clear graphical representations and direct comparisons of different market structures for simple yet deeply enlightening hydrothermal coordination cases.,"A didactic framework provides graphical solutions and comparisons for economic dispatch under various market environments, focusing on social benefit and consumer payment.",LP,LP,Optimization,LP,,Not specified,Not specified,,False,10.1109/TDC.2005.1546973,"Abstract, Intro, Conclusion",
1-153,"Baslis, C. G.; Bakirtzis, A. G.",2009,2009,2005–2009,Hourly-discretized mid-term power system operation in a competitive energy market,IEEE Xplore,C,Deregulated hydrothermal power systems require efficient mid-term operational strategies to manage reservoir water and thermal unit commitment while maximizing profits for dominant firms.,"Standard optimization models often separate medium-term water management from short-term operational constraints, leading to less realistic representation of system operation.",An optimization-based method using mixed integer programming jointly models yearly reservoir management and hourly thermal unit commitment decisions for asymmetric oligopoly markets.,MILP,MILP,Optimization,MILP,,Not specified,Not specified,,False,10.1109/PTC.2009.5282072,"Abstract, Intro",
1-154,"Zhang, S.; Ma, G.; Chen, S.; Huang, W.; Yang, Y.",2022,2022,2020–2025,Hydropower Pricing Options for Cross-Border Electricity Trading in China Based on Bi-Level Optimization,IEEE Xplore,C,Significant spatial mismatches between power supply and demand in South Asian countries necessitate efficient cross-border electricity trading strategies to support regional economic development.,Existing cross-border trade models often fail to account for the nonconvex and nonlinear constraints introduced by cascade hydropower stations in pricing decisions.,A bi-level optimization model uses mixed-integer linear programming to determine optimal hydropower pricing options for cross-border trading while ensuring system stability.,MILP,MILP,Optimization,MILP,,Not specified,Not specified,,False,10.1109/ACCESS.2022.3196910,"Intro, Nomenclature, Conclusion",
1-155,"Liu, Y.; Zhang, N.; Kang, C.; Xia, Q.; Wu, H.; Chen, Z.",2017,2017,2015–2019,Impact of Carbon market on China's electricity market: An equilibrium analysis,IEEE Xplore,E,Power plant operators must navigate complex bidding strategies in coupled electricity and carbon markets to maximize profit under regulatory constraints.,Analytical methods struggle with the complexity of Nash equilibrium in multi-market environments involving both generation rights and carbon trading. (inferred).,A bi-level model and a Nash equilibrium solving algorithm optimize bidding strategies for power plants participating in generation right and carbon markets.,Econ-Engi,Econ-Engi,Economic-Engineering,Econ-Engi,,Not specified,Not specified,,False,10.1109/PESGM.2017.8274309,"Sec II, Sec III",
1-156,"Haugen, M.; Schaffer, L. E.; Mo, B.; Helseth, A.",2020,2020,2020–2025,Impact on hydropower plant income from participating in reserve capacity markets,IEEE Xplore,F,Tighter integration of European power systems and increased renewable penetration require individual hydropower plants to evaluate future income potential across multiple markets.,Previous modeling frameworks lacked the combination of long-term strategic and detailed short-term components for evaluating income potential for individual hydropower plants.,A hydro-thermal multi-market model uses linearized start-up costs to evaluate future income potential for individual Nordic hydropower plants across various markets.,LP,LP,Optimization,LP,,Not specified,Not specified,,False,10.1109/EEM49802.2020.9221881,"Intro, Methodology",
1-157,"Song, M.; Amelin, M.",2015,2015,2015–2019,Improving the efficiency of a hydro-thermal power system utilizing demand-side flexibility,IEEE Xplore,R,"Seasonal and hourly load patterns lead to the inefficient commitment of expensive peak generators while low-cost generators remain underutilized, causing electricity price volatility.",The potential impact of shifting customer loads across twenty-four hours on the overall efficiency of an isolated power generation system remains insufficiently analyzed (inferred).,A linear mathematical model redistributes daily consumption to minimize total generation costs by leveraging demand-side flexibility in systems with hydropower and intermittent sources.,LP,LP,Optimization,LP,,Not specified,Not specified,,False,10.1109/EEM.2015.7216687,"Intro, Formulation",
1-158,"Justino, T.; Marzano, L.; Melo, A.; Maceira, M.; Batista, F.",2016,2016,2015–2019,Incorporating multi-area reliability concepts to the evaluation of the Brazilian power system capacity to supply the peak load,IEEE Xplore,G,"Hydropower systems face uncertainties in peak generation capacity because available power depends on water head and stored volumes, which vary with stochastic streamflows and hydrological trends.",Traditional multi-area reliability evaluation often ignores the specific dependencies of peak capacity on water value and reservoir storage levels in large-scale hydropower systems (inferred).,A methodology uses the NEWAVE and CONFINT models to calculate basic reliability indices like LOLP by integrating multi-area adequacy analysis with multivariate synthetic energy inflow scenarios.,SDDP,SDDP,Optimization,SDDP,,Not specified,Not specified,,False,10.1109/PSCC.2016.7541015,"Intro, Multi-area Reliability",
1-159,"Mendes, C.; Staffell, I.; Green, R.",2022,2022,2020–2025,Increasing Price Granuality in Electricity System Models,IEEE Xplore,D,Existing electricity market models often lack transparency and struggle to replicate realistic daily price variation and spikes for storage arbitrage.,Current structural models frequently misrepresent the volatility and amplitude of price spikes necessary for valuing flexible peak capacity and storage.,An extended linear dispatch model uses a quadratic cost function and post-optimizer transformation to replicate historic price time-series and volatility.,LP,LP,Optimization,LP,,Not specified,Not specified,,False,10.1109/EEM54602.2022.9920990,"Intro, Conclusion",
1-160,"Tveten Asa, G.; Bolkesjo Torjus, F.",2016,2016,2015–2019,Increasing the market value of solar and wind power through interconnection,IEEE Xplore,D,Integrating high rates of solar and wind power deployment requires flexibility measures to maintain market value and ensure power system reliability.,Existing flexibility studies focus on reliability rather than the market value of renewables and often treat hydropower supply in a stylized way.,A linear partial equilibrium model simulates the influence of increased transmission interconnection on the market value of solar and wind power.,LP,LP,Optimization,LP,,Not specified,Not specified,,False,10.1109/EEM.2016.7521333,"Intro, Sec II",
1-162,"Barroso, L.; Flach, B.; Kelman, R.; Bezerra, B.; Binato, S.; Bressane, J.; Pereira, M.",2005,2005,2005–2009,Integrated gas-electricity adequacy planning in Brazil: technical and economical aspects,IEEE Xplore,R,Decoupling natural gas and electricity scheduling leads to dangerously optimistic dispatch results that ignore gas production and transportation constraints during hydropower shortages.,"Scheduling models lack the integration of gas network physical constraints, leading to infeasible thermal dispatch decisions by system operators in hydro-dominated systems (inferred).",A coordination assessment identifies the risks of ignoring gas infrastructure limits in power sector models and highlights the need for integrated natural gas and electricity scheduling.,Theoretical,Other,Review/Theoretical,Theoretical,,Not specified,Not specified,,False,10.1109/PES.2005.1489151,Intro,
1-163,"Ojeda-Esteybar, D. M.; Rubio-Barros, R. G.; Vargas, A.",2017,2017,2015–2019,Integrated operational planning of hydrothermal power and natural gas systems with large scale storages,IEEE Xplore,R,The close interdependency between natural gas and electric power systems requires integrated methodologies to optimize energy resources and improve decision-making for system operators.,Existing integrated models do not properly address the coordinated management of both hydropower reservoirs and natural gas storage facilities in medium-term operational planning.,"A medium-term operational planning model integrates hydrothermal and natural gas systems, assessing the interdependency of their respective storage facilities using multi-stage decomposition.",MILP,MILP,Optimization,MILP,,Not specified,Not specified,,False,10.1007/s40565-017-0282-3,"Intro, Contribution, Conclusion",
