ID,Authors,Year,Year_numeric,Decade,Title,Search engine,Classification,Problem_statement,Research_gap,Contribution,Method,Method_clean,Method_category,Method_detail,Study region,Study_region_clean,Study_region_continent,Numerical water value,Has_water_value,DOI,Extraction_source,Notes
1-393,"Helseth, A.; Fodstad, M.; Mo, B.",2016,2016,2015–2019,Optimal Medium-Term Hydropower Scheduling Considering Energy and Reserve Capacity Markets,Scopus,A,Selling both energy and spinning reserve capacity requires decomposing multi-week optimization problems into manageable stages while accurately representing time-couplings and stochastic dual price nodes.,Decomposed models lacked a Benders decomposition approach that effectively averages coefficients over inflow samples to construct cuts for both energy volume and reserved capacity states. (inferred).,A decomposed optimization model uses Benders cuts to optimize weekly hydropower sales of energy and spinning reserve capacity across stochastic inflow and price scenarios over a planning horizon.,SDP,SDP,Optimization,SDP,,Not specified,Not specified,Yes,True,10.1109/TSTE.2015.2509447,"Intro, Sec 3",
1-394,"Riddervold, H. O.; Skjelbred, H. I.; Kong, J.; Elvetun, O. L.; Korpås, M.",2019,2019,2015–2019,Optimal Pricing of Production Changes in Cascaded River Systems with Limited Storage,Scopus,B,,,,MILP,MILP,Optimization,MILP,,Not specified,Not specified,,False,10.1007/978-3-030-03311-8_7,,
1-397,"Mahakalanda, I.; Dye, S.; Read, E. G.; Starkey, S. R.",2013,2013,2010–2014,Representing flow mixing demands in a multi-nodal CDDP model of a mixed used catchment,Scopus,H,"Managing river catchments with competing hydropower, irrigation, and thermal power plant cooling requirements requires regulating releases to manage downstream water temperature levels for ecosystems.",Standard hydro-reservoir optimization models impose hard constraints to satisfy consumptive demands but lack a multi-nodal approach to handle uses with complex water-mixing requirements.,"A deterministic multi-node stochastic dynamic programming (then ""SDP"") algorithm constructs demand curves for release to efficiently allocate water in catchments with mixing and temperature constraints.",Other,Other,Other,Other,,Not specified,Not specified,,False,10.36334/modsim.2013.L16.mahakalanda,"Abstract, Intro, Conclusions",
1-398,"Guisández, I.; Pérez-Díaz, J. I.; Nowak, W.; Haas, J.",2020,2020,2020–2025,Should environmental constraints be considered in linear programming based water value calculators?,Scopus,A,"Hydropower plants face increasing complexity from environmental constraints like maximum ramping rates and minimum flows, which significantly impact operational flexibility and long-term scheduling profitability.",Scientific literature lacked a comprehensive study on the joint effects of environmental constraints when determining the water value for use in subsequent short-term scheduling simulations. (inferred).,A methodology using an SDP-based water value calculator and a scheduling simulator demonstrates that including ramping and flow constraints in water value calculations improves total operational profits.,LP,LP,Optimization,LP,,Not specified,Not specified,,False,10.1016/j.ijepes.2019.105662,"Intro, Conclusions",
1-399,Xu G.; Sun H.,2014,2014,2010–2014,Study on load distribution model and optimal operation strategy for cascade hydropower stations in market conditions,Scopus,B,,,,Not available,Not available,Not available,Not available,,Not specified,Not specified,,False,,,
1-400,"Jahns, C.; Podewski, C.; Weber, C.",2020,2020,2020–2025,Supply curves for hydro reservoirs – Estimation and usage in large-scale electricity market models,Scopus,C,Large-scale electricity market models require an adequate representation of hydropower reservoirs to accurately answer research questions without suffering from the curse of dimensionality.,Previous models lack empirically validated supply curves for hydro reservoirs that can be implemented in fundamental models without exorbitantly increasing calculation time.,"An econometric approach estimates validated supply curves for Norwegian hydro reservoirs, which are then integrated into the Joint Market Model for realistic simulation.",Other,Other,Other,Other,,Not specified,Not specified,,False,10.1016/j.eneco.2020.104696,"Intro, Conclusion",
1-401,"Guisández, I.; Pérez-Díaz, J.; Wilhelmi, J.",2016,2016,2015–2019,The Influence of Environmental Constraints on the Water Value,Scopus,B,The establishment of seasonal minimum flows and flow ramping rates to ensure environmental sustainability alters the operational value of stored water resources.,Quantitative analysis of how seasonal minimum flows specifically interact with and counteract the economic effects of ramping rates on water value was missing.,"An optimization model using stochastic dynamic programming (then ""SDP"") identifies that minimum flows increase water value during wet seasons while ramping rates decrease it.",SDP,SDP,Optimization,SDP,,Not specified,Not specified,Yes,True,10.3390/en9060446,"Abstract, Intro, Conclusions",
1-405,"Skjelbred, H. I.; Kong, J.",2019,2019,2015–2019,A comparison of linear interpolation and spline interpolation for turbine efficiency curves in short-term hydropower scheduling problems,Scopus,R,"Short-term hydropower scheduling requires a precise representation of the generating unit's production function, which is a nonlinear function of net head and discharge.","Actual turbine efficiency values for working points are usually linearly interpolated from Hill charts, which can lead to significant errors in power output calculations (inferred).",A comparative study demonstrates that spline interpolation provides a more accurate prediction of turbine efficiency between measured points than linear interpolation for day-ahead scheduling.,,Not available,Not available,Not available,,Not specified,Not specified,,False,10.1088/1755-1315/240/4/042011,"Intro, Numerical Results, Conclusions",
1-407,"Feng, S.; Zheng, H.; Gong, D.; Sun, J.; Wang, J.",2025,2025,2020–2025,A Dynamic and Multidimensional Framework to Reveal and Interpret Marginal Values in Cascade Reservoir Scheduling Under Competing Demands,Scopus,A,"Global climate change and growing demand exacerbate reservoir allocation imbalances, requiring dynamic valuation methods that can capture the spatiotemporal heterogeneity and trade-offs in cascade operations.",Traditional valuation methods lacked a multidimensional framework that overcomes the duality gap in MILP models to assess marginal values of resources like storage and turbine capacity. (inferred).,"A multidimensional framework uses two practical methods for MILP shadow pricing to assess marginal values of water, storage, and turbine capacity in cascaded reservoir systems.",MILP,MILP,Optimization,MILP,China,China,Asia/Oceania,,False,10.1029/2025WR040598,"Abstract, Intro",
1-409,"Kounalakis, M.; Theodorou, P.",2019,2019,2015–2019,A hydrothermal coordination model for electricity markets: theory and practice in the case of the Greek electricity market regulatory framework,Scopus,G,"Managing cooperative generation between hydro and thermal units is complex due to mixing linear and nonlinear equations, which limits the practical implementation of algorithms in business environments.","Most hydrothermal coordination research for the Greek context is descriptive, lacking algorithmic mathematical programming models that offer high practicality and low running times for corporations.","A short-term hydrothermal coordination model using Mixed Integer Programming offers a simplified, practical method for optimizing dispatch in the Greek Mandatory Pool market.",MILP,MILP,Optimization,MILP,Greek,Greece,Europe,,False,10.1016/j.seta.2019.04.012,"Intro, Literature review",
1-410,"Peña, J. I.",2024,2024,2020–2025,A note on hydropower as a marginal price setter for Spain's electricity market in 2021–2022,Scopus,A,"Regulatory changes in supply price limits in Spain require an analysis of how different technologies, particularly hydropower, act as marginal price setters and impact market remuneration.",Scientific analysis lacked an evaluation of the impact of European-mandated price limit changes on the Spanish wholesale market's technology-specific remuneration and price-setting behavior for 2021-2022. (inferred).,"This analysis identifies hydropower as a key marginal price setter in the Spanish market, demonstrating how technology-specific remuneration changed under new European supply price regulation boundaries.",,Not available,Not available,Not available,Spain,Spain,Europe,,False,10.1016/j.jup.2024.101726,"Intro, Sec 3",
1-411,"Camelo, S.; Papavasiliou, A.; De Castro, L.; Riascos, Á.; Oren, S.",2018,2018,2015–2019,A structural model to evaluate the transition from self-commitment to centralized unit commitment,Scopus,F,Self-committed uniform price auctions with energy-only offer prices can lead to productive inefficiencies and unnecessary risks for thermal unit suppliers.,"Existing models often ignore startup costs in dispatch, necessitating improved mixed-integer programs that better reflect generators' true cost structures. (inferred).",A mixed-integer linear programming model calculates an ideal dispatch to minimize total production costs while accounting for thermal plant ramping and startup.,,Not available,Not available,Not available,Columbia,Colombia,South America,,False,10.1016/j.eneco.2018.09.009,"Intro, Appendix",
1-413,"Loschenbrand, M.; Korpas, M.",2016,2016,2015–2019,An agent based model of a frequency activated electricity reserve market,Scopus,R,Constant changes in legislatures and technical constraints require continuous analysis of market design and consistency in electricity frequency restoration markets.,Traditional modeling approaches based on economic theory struggle with simulating the non-rational behavior of system participants or incorporating time-dynamic equilibria in ancillary markets.,An agent-based model using individual and independent agents simulates participant behavior and evaluates the efficiency of different pricing systems in frequency restoration markets.,,Not available,Not available,Not available,Norway,Norway,Europe,,False,10.1109/PMAPS.2016.7764159,"Intro, Discussion",
1-414,"Huskova, I.; Harou, J. J.",2012,2012,2010–2014,An agent model to simulate water markets,Scopus,R,Catchments with increasing water scarcity and no further available licenses need effective and economically efficient strategies to mitigate supply-demand imbalances.,Existing tools lacked a screening simulator that predicts economically efficient pair-wise trade while representing its interaction with natural flows and engineered infrastructure.,An optimization-driven water market simulator emulates license-holders' willingness to engage in short-term trade based on differences in marginal water values over space and time.,,Not available,Not available,Not available,"Dove Basin, UK",United Kingdom,Europe,,False,,"Abstract, Model Assumptions",
1-415,"Turgeon, A.; Charbonneau, R.",1998,1998,Pre-2000,An aggregation‐disaggregation approach to long‐term reservoir management,Scopus,C,Hydro-Quebec needs an efficient monthly releasing policy for its twenty-six seasonal and interannual reservoirs over several years while managing random inflow behavior.,"Existing stochastic optimization methods, like stochastic dynamic programming (SDP), are often too computationally demanding to solve multireservoir problems with many state variables.",An aggregation-disaggregation method uses functions of two variables to solve the monthly releasing policy for twenty-six large reservoirs in less than fifty minutes.,,Not available,Not available,Not available,Canada,Canada,North America,,False,10.1029/98WR02608,"Abstract, Conclusion",
1-416,"Wilson, I.; Barbour, E.; Ketelaer, T.; Kuckshinrichs, W.",2018,2018,2015–2019,An analysis of storage revenues from the time-shifting of electrical energy in Germany and Great Britain from 2010 to 2016,Scopus,G,Understanding how changing generation mixes affect storage revenues is difficult because time-shifting profits are highly variable and subject to factors that are challenging to predict.,There is a knowledge gap regarding how evolving electricity price profiles in the German and British markets have specifically affected the time-shifting revenues available to storage operators.,A random sampling algorithm established the maximum available revenue from time-shifting by sampling time periods and scaling energy units within storage device physical constraints.,,Not available,Not available,Not available,UK & Germany,Multi-country,Europe,,False,10.1016/j.est.2018.04.005,"Gap, Algorithm",
1-417,"Loomis, J.",1995,1995,Pre-2000,"An Economic Approach to Giving ""Equal Consideration"" to Environmental Values in FERC Hydropower Relicensing",Scopus,H,,,,,Not available,Not available,Not available,US,United States,North America,,False,,,
1-418,"Tang, O.; Rehme, J.",2017,2017,2015–2019,An investigation of renewable certificates policy in Swedish electricity industry using an integrated system dynamics model,Scopus,G,"Fragmented energy policies and support schemes can lead to decisions that are detrimental to long-term environmental and economic goals within complex, nonlinear electricity markets.","The electricity sector lacks a holistic system-view model that describes the complex interactions between strategic capacity decisions, operational production, and renewable certificate market pricing.",An integrated system dynamics model coded in Visual Basic describes the nonlinear interactions of strategic and operational variables in the Swedish electricity and certificate markets.,,Not available,Not available,Not available,Sweden and Norway,Nordic countries (region),Europe,,False,10.1016/j.ijpe.2017.03.012,"Intro, Methodology",
1-419,M. Pahlow; C. Mohrlen; J. U. Jorgensen,2009,2009,2005–2009,Application of cost functions for large scale integration of wind power using a multi-scheme ensemble prediction technique,Scopus,R,Large amounts of intermittent wind power cannot be integrated seamlessly into the electrical grid without storage and accurate forecasting to ascertain smooth operation.,Market participants lacked an optimization strategy that combines forecasts with grid constraints to reduce balancing costs in systems handling price-maker volumes of wind power.,A multi-scheme ensemble prediction technique uses weather forecasting on large scales to predict optimal prices and manage imbalances for price-maker wind power producers.,Not available,Not available,Not available,Not available,,Not specified,Not specified,,False,,"Problem, Price Maker section, Results",
1-420,"Helseth, A.; Haugen, M.; Farahmand, H.; Mo, B.; Jaehnert, S.; Stenkløv, I.",2021,2021,2020–2025,Assessing the benefits of exchanging spinning reserve capacity within the hydro-Dominated nordic market,Scopus,F,Low-carbon system transitions increase the need for fast-responding reserves while national procurement practices often lead to suboptimal system solutions.,Assessments of cross-border reserve exchange benefits have not been reported using models with detailed representation of complex cascaded hydropower systems.,A hydrothermal scheduling toolchain combines long-term water value estimation with short-term unit commitment to quantify benefits of exchanging spinning reserve capacity.,,Not available,Not available,Not available,Nordic system,Nordic countries (region),Europe,,False,10.1016/j.epsr.2021.107393,"Abstract, Intro",
1-422,"Street, A.; Valladão, D.; Lawson, A.; Velloso, A.",2020,2020,2020–2025,Assessing the cost of the Hazard-Decision simplification in multistage stochastic hydrothermal scheduling,Scopus,C,Current stochastic dynamic programming (SDP) implementations for hydrothermal scheduling rely on optimistic informational assumptions that bias the assessment of the water value.,"System operators have neglected the ""Hazard-Decision"" simplification issue, which assumes dispatch decisions are made only after observing the one-step-ahead water inflow realization.",An augmented-state decision-hazard SDP framework better characterizes actual decision processes to provide an accurate assessment of the water value for the Brazilian system.,SDDP,SDDP,Optimization,SDDP,Brazil,Brazil,South America,,False,10.1016/j.apenergy.2020.115939,"Abstract, Intro, Contribution",
1-423,O. Z. Sigalla; R. M. J. Kadigi; J. R. Selemani,2022,2022,2020–2025,Assessment of Variation in Marginal Productivity Value of Water in Paddy Farming Systems in Times of Water Stress,Scopus,H,,,,Other,Other,Other,Other,Africa,Africa (region),Africa,Yes,True,,,
1-424,"Schillinger, M.",2020,2020,2020–2025,Balancing-market design and opportunity cost: The Swiss case,Scopus,F,Energy transitions require national balancing markets to adapt to guideline changes for increased coordination and participation of renewable actors.,There is a lack of operational models quantifying the opportunity costs of hydropower for providing balancing reserves under different market designs.,An operational model for a set of Swiss hydropower plants quantifies the opportunity costs of balancing provision under various market designs.,LP,LP,Optimization,LP,Swiss,Switzerland,Europe,,False,10.1016/j.jup.2020.101045,"Abstract, Intro",
1-425,"Kuhn, A.; Britz, W.",2012,2012,2010–2014,Can hydro-economic river basin models simulate water shadow prices under asymmetric access?,Scopus,E,"Classical hydro-economic models often assume central planning or perfect markets, failing to reflect individually optimal decisions in unregulated environments.","Standard optimization formats cannot control physical balances and complementary shadow price relations simultaneously for multiple independent, physically coupled decision-makers.",A new solution format based on the mixed complementarity problem simulates decentralized water use decisions while maintaining physical basin interdependences.,LP,LP,Optimization,LP,Generic/Theoretical,Synthetic/Theoretical,Not applicable,,False,10.2166/wst.2012.251,"Abstract, Intro",
1-427,"Kazem, M.; Mc.Phee, D.; Torkaman Rashid, A.; Kazem, A.",2016,2016,2015–2019,Climate change and economic approaches into water allocation: optimization via direct benefits of water—the case study of Rudbar Lorestan hydropower dam (Iran),Scopus,B,"Water policymakers must allocate flows among urban, industrial, and hydropower sectors while adhering to reliability standards and minimum downstream discharge requirements.",Optimizing allocation patterns across demand sectors fails to account for how future reliability standard restrictions impact current hydropower production and storage. (inferred).,A matrix optimization methodology using conjugate gradient-based solvers determines the best time-series allocation to maximize total economic benefits for reservoir systems.,Other,Other,Other,Other,Iran,Iran (Islamic Republic of),Asia/Oceania,Yes,True,10.1007/s40899-016-0067-2,"Sec 1, Results, App 1",
1-428,"Moghimi, F. H.; Fälth, H. E.; Reichenberg, L.; Siddiqui, A. S.",2023,2023,2020–2025,Climate Policy and Strategic Operations in a Hydro-Thermal Power System,Scopus,A,"Conflicting objectives between profit-maximizing power companies and social goals create significant uncertainty for policymakers regarding market outcomes, strategic incentives, and the effectiveness of climate policy targets.",Existing methodologies often utilize open-loop Cournot models for storage without adequately comparing the potential for strategic behavior across distinct future renewable energy portfolios and CO2 price scenarios. (inferred).,"A spatially constrained Nash-Cournot model investigates strategic reservoir use, proving that carbon pricing and increased renewable integration significantly influence hydropower operational incentives and social welfare outcomes.",Econ-Engi,Econ-Engi,Economic-Engineering,Econ-Engi,Nordpool,Nordic countries (region),Europe,,False,10.5547/01956574.44.4.fmog,"Intro, Sec 2, Sec 3",
1-429,"Hjelmeland, M. N.; Korpas, M.; Helseth, A.",2016,2016,2015–2019,Combined SDDP and simulator model for hydropower scheduling with sales of capacity,Scopus,A,"Detailed hydropower scheduling including capacity sales adds significant complexity to linear programming problems, making it difficult to obtain realistic unit operating points and accurate system flexibility estimates.",Traditional linear programming formulations in medium-term models lack the technical detail required to represent power-discharge functions and minimum generation restrictions accurately during the provision of capacity reserves. (inferred).,"A combined model integrates a Simulator Model based on mixed integer programming to benchmark linear approximations, demonstrating a 29.2% reduction in calculated capacity sales profit.",SDDP,SDDP,Optimization,SDDP,Norway,Norway,Europe,,False,10.1109/EEM.2016.7521187,"Abstract, Intro, Sec II",
1-432,"Pfeifer, A.; Krajačić, G.; Haas, R.; Duić, N.",2020,2020,2020–2025,Consequences of different strategic decisions of market coupled zones on the development of energy systems based on coal and hydropower,Scopus,D,Strategic decisions in market-coupled zones can lead to stranded costs or unfair exploitation of other zones for balancing supply and demand.,There is a need for detailed representations of short-term large-scale power system operations that integrate unit commitment and cross-border power flows.,An application of the Dispa-SET modeling framework analyzes the consequences of different strategic decisions on interconnected coal and hydropower systems.,,Not available,Not available,Not available,Balkan,Europe (region),Europe,,False,10.1016/j.energy.2020.118522,"Method, Sec 2",
1-433,"Verbic, G.; Gubina, F.",2003,2003,2000–2004,Cost-Based Models for the Power-Reserve Pricing of Frequency Control,Scopus,D,Managing ancillary services and power reserves requires reliable cost estimation based on the bidding strategies of different power-reserve providers.,Comparison of different methodologies for estimating secondary and tertiary frequency control costs requires more detailed operational experience and strategy inclusion. (inferred).,A methodology for estimating power reserve costs incorporates provider bidding strategies and operational experience for reliable secondary frequency control assessment. (inferred).,Other,Other,Other,Other,Slovenia,Slovenia,Europe,,False,10.1109/TPWRS.2004.835668,Conclusion,
1-435,K. W. Easter,2009,2009,2005–2009,"Demand management, privatization, water markets, and efficient water allocation in our cities",Scopus,G,"Inefficient water management by the public sector can lead to waste and misallocation, especially when no mechanism exists to shift water to newer, higher-valued uses.","While proponents advocate for full water privatization, there is a lack of rigorous analysis defining which core oversight functions must remain with public institutions (inferred).","An analytical thesis defines the limits of privatization, arguing that ultimate authority over water rights and oversight for third-party protection must remain with public sector institutions.",Not available,Not available,Not available,Not available,USA,United States,North America,,False,,"Abstract, Evaluate system",
1-436,"Bocker, B.; Weber, C.",2015,2015,2015–2019,Different storages and different time-variable operation modes of energy storages in future electricity markets,Scopus,G,"Reduced flexibility from conventional power plants due to high renewable feed-in requires energy storage, yet storage values change over time, complicating their position in the merit order.","Insights are needed into how different time-variable operation modes of various storage technologies, such as Li-Ion and power-to-gas, affect merit-order positioning and investment refinancing.",An analytical approach using a linear energy system model identifies two major operation modes for energy storage based on shadow prices and time-varying water values.,Econ-Engi,Econ-Engi,Economic-Engineering,Econ-Engi,Germany,Germany,Europe,,False,10.1109/EEM.2015.7216686,"Abstract, Methodology",
1-437,"Munoz, F. D.; Wogrin, S.; Oren, S. S.; Hobbs, B. F.",2018,2018,2015–2019,Economic Inefficiencies of Cost-based Electricity Market Designs,Scopus,E,Cost-based spot market designs can be inefficient because they allow market power exercise through incentives for underinvestment or peaking technology shares.,There is a lack of analysis comparing the welfare losses between cost-based and bid-based market designs under strategic behavior. (inferred).,A closed-loop equilibrium model emulates bid-based versus cost-based market designs to analyze welfare losses from strategic participation.,Other,Other,Other,Other,Generic/Theoretical,Synthetic/Theoretical,Not applicable,,False,10.5547/01956574.39.3.fmun,"Intro, Sec 1",
1-438,"Woo, C.; Chen, Y.; Olson, A.; Moore, J.; Schlag, N.; Ong, A.; Ho, T.",2017,2017,2015–2019,Electricity price behavior and carbon trading: New evidence from California,Scopus,R,"Wholesale electricity markets face high price volatility due to weather-sensitive demands, fuel-cost variations, transmission constraints, and carbon-price fluctuations in restructured environments.",A regression-based approach analyzing newly available market data to understand the impact of aggressive renewable targets and carbon trading on price dynamics was needed.,A regression-based analysis generalized for multiple jurisdictions uses California market data to evaluate the impact of RPS targets and carbon trading on electricity prices.,,Not available,Not available,Not available,"CA, US",United States,North America,,False,10.1016/j.apenergy.2017.07.070,"Intro, Results",
