ID,Authors,Year,Year_numeric,Decade,Title,Search engine,Classification,Problem_statement,Research_gap,Contribution,Method,Method_clean,Method_category,Method_detail,Study region,Study_region_clean,Study_region_continent,Numerical water value,Has_water_value,DOI,Extraction_source,Notes
1-014,"Pereira-Cardenal, S. J.; Mo, B.; Riegels, N. D.; Arnbjerg-Nielsen, K.; Bauer-Gottwein, P.",2015,2015,2015–2019,Optimization of Multipurpose Reservoir Systems Using Power Market Models,Scopus,A,"Management of Mediterranean surface water systems is complicated by high interannual inflow variability, necessitating better quantification of the economic benefits provided by reservoir storage across various hydrologic conditions.",Existing literature for Spanish basins lacked a robust methodology to determine state-dependent water value for storage that account for non-linear economic benefits and stochastic inflow patterns. (inferred).,"A modeling framework uses SDP to derive monthly water value functions for equivalent reservoir levels, demonstrating how storage values fluctuate between dry and very wet hydrologic years.",SDP,SDP,Optimization,SDP,,Not specified,Not specified,Yes,True,10.1061/(ASCE)WR.1943-5452.0000500,"Intro, Fig 2",
1-015,"Denaro, S.; Cuppari, R. I.; Kern, J. D.; Su, Y.; Characklis, G. W.",2022,2022,2020–2025,Assessing the Bonneville Power Administration’s Financial Vulnerability to Hydrologic Variability,ASCE Library,C,The Bonneville Power Administration faces significant financial risk from extreme and compound hydrometeorological events that impact the stability of the West Coast bulk electric power system.,Existing risk assessment frameworks lack integrated stochastic generators and unit commitment models that can simulate hourly system operations and wholesale prices under historical stationary trends. (inferred).,The CAPOW unit commitment and economic dispatch model accurately reproduces generation and transmission to simulate hourly system operations and wholesale prices for the Mid-C and CAISO markets.,MILP,MILP,Optimization,MILP,,Not specified,Not specified,,False,10.1061/(ASCE)WR.1943-5452.0001590,"Stochastic Hydrometeorological Generator, CAPOW",
1-016,"Luchner, J.; Riegels, N. D.; Bauer-Gottwein, P.",2019,2019,2015–2019,Benefits of Cooperation in Transnational Water-Energy Systems,ASCE Library,A,"Transboundary river basins experience significant economic impacts from competition between upstream hydropower and downstream irrigation interests, especially under population growth and climate change pressures.",Existing modeling frameworks for semiarid international basins often lack endogenous determination of hydropower values in a way that effectively simulates multi-sectoral reservoir operations. (inferred).,A methodology combining SDP with the water value method optimizes reservoir operations and maximizes agricultural benefits while minimizing power production costs in the Syr Darya.,SDP,SDP,Optimization,SDP,,Not specified,Not specified,Yes,True,10.1061/(ASCE)WR.1943-5452.0001047,"Intro, Sec 2",
1-017,"Côté, P.; Leconte, R.",2016,2016,2015–2019,Comparison of Stochastic Optimization Algorithms for Hydropower Reservoir Operation with Ensemble Streamflow Prediction,ASCE Library,B,Managing reservoir inflows is a difficult stochastic optimization problem because water supply cannot be forecasted accurately long in advance due to natural seasonality.,Previous studies lacked direct comparisons between diverse stochastic techniques using standardized test beds for operational multireservoir hydropower systems under identical inflow forecasts. (inferred).,A comparison test bed for four optimization techniques shows that sampling SDP provides better operating policies than deterministic approaches for multireservoir management.,Other,Other,Other,Other,,Not specified,Not specified,,False,10.1061/(ASCE)WR.1943-5452.0000575,"Intro, Sec 3, Results",
1-018,"Yang, Y. E.; Zhao, J.; Cai, X.",2012,2012,2010–2014,Decentralized Optimization Method for Water Allocation Management in the Yellow River Basin,ASCE Library,A,"Centralized management models often fail to capture the spatial heterogeneity and complex interactions between individual water users, making them difficult to solve for nonlinear basin-level variables.",Previous research lacked a decentralized framework that reformulates optimization algorithms to determine local water prices under system equilibrium within a heterogeneous physical and political context. (inferred).,A decentralized optimization algorithm integrated with a Multiple Agent System (MAS) determines local water prices and balances human and natural water demands under market clearing conditions.,Econ-Engi,Econ-Engi,Economic-Engineering,Econ-Engi,,Not specified,Not specified,Yes,True,10.1061/(ASCE)WR.1943-5452.0000199,"Intro, Conclusions",
1-019,"Marques, G. F.; Lund, J. R.; Leu, M. R.; Jenkins, M.; Howitt, R.; Harter, T.; Hatchett, S.; Ruud, N.; Burke, S.",2006,2006,2005–2009,"Economically Driven Simulation of Regional Water Systems: Friant-Kern, California",ASCE Library,H,"Complex water resource systems require integrated management of physical, infrastructure, and economic components to support decision-making in agricultural regions where water value drives user behavior.",Engineering simulation models lack the capability to capture real behavior behind water use decisions in systems that are largely economically driven by market conditions.,An integrated model combines economic water demands with complex physical simulation in MODSIM to estimate operational impacts of policy alternatives for the Friant-Kern system.,Econ-Engi,Econ-Engi,Economic-Engineering,Econ-Engi,,Not specified,Not specified,Yes,True,10.1061/(ASCE)0733-9496(2006)132:6(468),"Intro, Regional Water System Simulation",
1-020,"Watkins, D. W.; Moser, D. A.",2006,2006,2005–2009,Economic-Based Optimization of Panama Canal System Operations,ASCE Library,H,Decision makers managing the Panama Canal system need to optimize reservoir releases for hydropower and navigation while accounting for both hydrologic variability and complex economic benefits.,Standard descriptive simulation models are unable to prescribe optimal monthly releases or estimate the economic benefits of marginal increases in system capacity under varying demands (inferred).,A prescriptive optimization model using the network primal simplex method determines optimal reservoir operations for hydropower generation and navigation while providing estimates of marginal economic benefits.,Econ-Engi,Econ-Engi,Economic-Engineering,Econ-Engi,,Not specified,Not specified,Yes,True,10.1061/(ASCE)0733-9496(2006)132:6(503),"Intro, Solution Algorithm, Summary",
1-021,"Génova, P.; Null, S. E.; Olivares, M. A.",2019,2019,2015–2019,Economic–Engineering Method for Assessing Trade-Offs between Instream and Offstream Uses,ASCE Library,B,Increasing population growth and climate change create intense competition between offstream hydropower uses and instream aquatic ecosystem or recreational water needs.,Existing hydro-economic models often fail to provide quantitative methods for valuing instream uses compared to well-established economic metrics for offstream water diversions.,A framework quantifying marginal water value trade-offs for instream and offstream uses demonstrates that environmental requirements significantly reduce hydropower generation benefits.,Econ-Engi,Econ-Engi,Economic-Engineering,Econ-Engi,,Not specified,Not specified,Yes,True,10.1061/(ASCE)WR.1943-5452.0001026,"Intro, Scenarios",
1-022,"Draper, A. J.; Jenkins, M. W.; Kirby, K. W.; Lund, J. R.; Howitt, R. E.",2003,2003,2000–2004,Economic-Engineering Optimization for California Water Management,ASCE Library,A,"California's complex water system traditionally relies on fragmented models that cannot provide a statewide, integrated economic-engineering overview necessary for identifying promising water transfers and facility expansions.","Scientific literature lacked a comprehensive, large-scale deterministic optimization model that reconciles statewide surface and groundwater data into a single, transparent, and documented intertied framework. (inferred).",The CALVIN model applies deterministic network flow optimization using economic objective functions to suggest management options like water marketing and cooperative operations for California’s entire system.,Econ-Engi,Econ-Engi,Economic-Engineering,Econ-Engi,,Not specified,Not specified,Yes,True,10.1061/(ASCE)0733-9496(2003)129:3(155),"Modeling Objectives, Conclusions",
1-023,"Côté, P.; Arsenault, R.",2019,2019,2015–2019,Efficient Implementation of Sampling Stochastic Dynamic Programming Algorithm for Multireservoir Management in the Hydropower Sector,ASCE Library,B,"Multireservoir systems with more than three reservoirs face the curse of dimensionality, making standard stochastic dynamic programming (then ""SDP"") computationally slow.",Software implementations of sampling SDP often lack efficient parallelization and state-space discretization strategies necessary to solve four-reservoir systems within reasonable operational timeframes.,Improved sampling SDP algorithm using Benders cuts and parallelization reduces computation time to under three minutes for a complex four-reservoir hydropower system.,SDP,SDP,Optimization,SDP,,Not specified,Not specified,,False,10.1061/(ASCE)WR.1943-5452.0001050,"Abstract, Intro, Conclusions",
1-026,"Erfani, M.; Maskey, M. L.; Dogan, M. S.; Medellin-Azuara, J.; Goharian, E.",2024,2024,2020–2025,Hydroeconomic Optimization and Reoperation of Folsom Reservoir for Flood-Managed Aquifer Recharge Implementation,ASCE Library,A,"Climate extremes and droughts in California require efficient water storage strategies, yet quantifying the economic benefits of groundwater recharge within complex surface storage systems remains challenging.",Methodology for integrating surface reservoir reoperation with managed aquifer recharge lacked a hybrid simulation-optimization model driven by surrogate economic evaluation modules derived from large-scale hydroeconomic systems. (inferred).,"A hybrid simulation-optimization model uses surrogate economic evaluation modules to optimize groundwater recharge and surface storage benefits, improving total water storage during varying hydrologic conditions.",Econ-Engi,Econ-Engi,Economic-Engineering,Econ-Engi,,Not specified,Not specified,,False,10.1061/JWRMD5.WRENG-6384,Methodology,
1-027,"Helseth, A.; Mo, B.; Hågenvik, H. O.; Schäffer, L. E.",2022,2022,2020–2025,Hydropower Scheduling with State-Dependent Discharge Constraints: An SDDP Approach,ASCE Library,B,"Environmental regulations requiring state-dependent maximum discharge introduce nonconvexities into hydropower scheduling, which are difficult to represent in standard stochastic dual dynamic programming models.","Current methodologies lack computationally efficient ways to approximate nonconvex environmental constraints without compromising computational time through stochastic dynamic programming (then ""SDP"") versions. (inferred).",A combination of constraint relaxation and time-dependent auxiliary reservoir bounds enables SDDP to handle discharge constraints without compromising computational efficiency or stability.,SDDP,SDDP,Optimization,SDDP,,Not specified,Not specified,Yes,True,10.1061/(ASCE)WR.1943-5452.0001609,"Abstract, Intro, Conclusions",
1-029,"Zhao, T.; Zhao, J.; Yang, D.",2014,2014,2010–2014,Improved Dynamic Programming for Hydropower Reservoir Operation,ASCE Library,G,Complex mathematical properties like complementarity in multi-period hydropower generation lead to high computational costs when solving optimization problems using traditional dynamic programming methods.,"Previous research on reservoir systems failed to investigate the combined effects of concavity, complementarity, and monotonicity specifically for multi-period hydropower reservoir optimization problems.",A successive improved dynamic programming (SIDP) algorithm applies concave approximations to reduce computational complexity from quadratic to linear for long-term hydropower scheduling.,Other,Other,Other,Other,,Not specified,Not specified,,False,10.1061/(ASCE)WR.1943-5452.0000343,"Abstract, Intro, Mathematical Properties",
1-030,"Ward, F. A.; Booker, J. F.; Michelsen, A. M.",2006,2006,2005–2009,"Integrated Economic, Hydrologic, and Institutional Analysis of Policy Responses to Mitigate Drought Impacts in Rio Grande Basin",ASCE Library,H,Growing competition for water supplies in dry regions like the Rio Grande Basin increases the economic and environmental impacts of severe and sustained drought events.,Little comprehensive analysis exists regarding the costs of drought and how market-based water transfers can be applied to design effective policy responses within existing institutions.,A comprehensive basinwide nonlinear programming model integrates hydrology and economics to evaluate the effectiveness of water trading across political boundaries during sustained drought periods.,Econ-Engi,Econ-Engi,Economic-Engineering,Econ-Engi,,Not specified,Not specified,Yes,True,10.1061/(ASCE)0733-9496(2006)132:6(488),"Background, Intro",
1-031,"Wang, L.; Fang, L.; Hipel, K. W.",2008,2008,2005–2009,Integrated Hydrologic-Economic Modeling of Coalitions of Stakeholders for Water Allocation in the South Saskatchewan River Basin,ASCE Library,E,"Water allocation models often ignore quality, stage constraints, and stakeholder coalition formations when pursuing overall net benefits for river basin management.",Existing integrated hydrologic-economic models lack structures to analyze user coalition formation and the specific effects of ownership and water rights.,"A holistic modeling framework integrates water quantity, quality, and cooperative game theory to analyze coalition formation and initial water right allocations.",Econ-Engi,Econ-Engi,Economic-Engineering,Econ-Engi,,Not specified,Not specified,Yes,True,10.1061/(ASCE)1084-0699(2008)13:9(781),"Intro, Sec 3",
1-032,"Davis, M. D.",2007,2007,2005–2009,Integrated Water Resource Management and Water Sharing,ASCE Library,R,"Sustainable water development requires redressing historical imbalances among economic, environmental, and social components while managing resources for marginalized groups and ecosystems.",Historical water management approaches often fail to integrate natural flow regimes or resolve conflicts between user-based focus and broader river basin efficiencies (inferred).,A review of IWRM frameworks evaluates the integration of environmental flows and public participation as essential elements for achieving social and ecological sustainability.,Review,Other,Review/Theoretical,Review,,Not specified,Not specified,,False,10.1061/(ASCE)0733-9496(2007)133:5(427),"Intro, Table 1",
1-034,"Draper, S. E.",2008,2008,2005–2009,Limits to Water Privatization,ASCE Library,F,Water scarcity threatens economic well-being and quality of life while public sector allocation inefficiencies are frequently blamed for mismanagement.,There is a lack of critical analysis regarding which core water management functions must remain public versus those that can be privatized. (inferred).,A theoretical framework defines essential public oversight functions required to protect third-party rights and social values during the water privatization process.,Discussion,Other,Review/Theoretical,Discussion,,Not specified,Not specified,,False,10.1061/(ASCE)0733-9496(2008)134:6(493),"Abstract, Intro",
1-035,"Shen, J.; Chen, G.; Cheng, C.; Wei, W.; Zhang, X.; Zhang, J.",2021,2021,2020–2025,Modeling of Generation Scheduling for Multiple Provincial Power Grids Using Peak-Shaving Indexes,ASCE Library,R,"Real-world industrial power production depends on optimizing generation schedules to follow changes in load demands, which is highly sensitive to the modeling of peak-shaving requirements.",Conventional optimization models mainly aim to smooth load profiles without quantitatively describing the specific dispatchable capacity requirements during both high and low load hours.,A mixed-integer nonlinear programming model introduces peak and off-peak capacity indexes to quantitatively optimize hydropower generation schedules for serving multiple provincial power grids.,Other,Other,Other,Other,,Not specified,Not specified,,False,10.1061/(ASCE)WR.1943-5452.0001424,"Intro, MINLP Model, Results",
1-036,"Debnath, D.; Boyer, T. A.; Stoecker, A. L.; Sanders, L. D.",2015,2015,2015–2019,Nonlinear Reservoir Optimization Model with Stochastic Inflows: Case Study of Lake Tenkiller,ASCE Library,B,Reservoir managers must balance competing demands between commercial hydropower generation and nonmarket recreational benefits while accounting for stochastic lake water inflow variability.,"Traditional stochastic models frequently overlook nonmarket recreational benefits, leading to water allocation policies that prioritize hydropower over significant regional economic visit values.",A stochastic optimization model integrating nonmarket visit values shows that maintaining higher lake levels can maximize total economic benefits across sectors.,Econ-Engi,Econ-Engi,Economic-Engineering,Econ-Engi,,Not specified,Not specified,Yes,True,10.1061/(ASCE)WR.1943-5452.0000409,"Intro, Sec 2, Results",
1-037,"Cutlac, I.; Horbulyk, T. M.",2011,2011,2010–2014,Optimal Water Allocation under Short-Run Water Scarcity in the South Saskatchewan River Basin,ASCE Library,B,"Water managers face challenges allocating flows among urban, agricultural, and hydropower users as land use changes and climate variability alter basin-wide hydrology.","No models existed for the South Saskatchewan River Basin that captured economic water value and hydrology within a comprehensive, replicable modeling platform.","A computational model using the Aquarius platform optimizes annual water value by reflecting economic welfare across irrigation, municipal, and hydropower sectors.",Econ-Engi,Econ-Engi,Economic-Engineering,Econ-Engi,,Not specified,Not specified,Yes,True,10.1061/(ASCE)WR.1943-5452.0000092,"Intro, Calibration",
1-038,"Lee, Y.; Yoon, T.; Shah, F. A.",2013,2013,2010–2014,Optimal Watershed Management for Reservoir Sustainability: Economic Appraisal,ASCE Library,R,"Reservoir sedimentation reduces societal benefits globally, and transboundary rivers create negative externalities where upstream agricultural soil erosion impacts downstream reservoir storage capacity.",Previous studies lacked an integrated economic model that characterizes both upstream soil conservation and downstream sediment removal under cooperative and noncooperative management perspectives.,A theoretical model using optimal control theory integrates upstream agricultural benefits and downstream reservoir capacity to determine the optimal terminal time for sustainable reservoir management.,Econ-Engi,Econ-Engi,Economic-Engineering,Econ-Engi,,Not specified,Not specified,,False,10.1061/(ASCE)WR.1943-5452.0000232,"Intro, Model and Methodology",
1-039,"Wang, J.; Zhang, Y.",2012,2012,2010–2014,Short-Term Optimal Operation of Hydropower Reservoirs with Unit Commitment and Navigation,ASCE Library,B,"Short-term hydropower operation is complicated by nonlinear production functions, discrete unit commitment statuses, and flow ramping requirements for safe river navigation.",Previous models often failed to integrate unit commitment with Muskingum channel routing while maintaining low execution times for multiple identical turbine units.,An integrated methodology using Lagrange multipliers and united generators achieves near-optimal solutions while reducing the dimensionality of the hydro subproblem.,NLP,Other,Optimization,NLP,,Not specified,Not specified,,False,10.1061/(ASCE)WR.1943-5452.0000142,"Abstract, Intro, Conclusions",
1-040,"Newlin, B. D.; Jenkins, M. W.; Lund, J. R.; Howitt, R. E.; Corps, P.; Republic, D.",2002,2002,2000–2004,Southern California Water Markets: Potential and Limitations,ASCE Library,A,"Regional water scarcity in southern California necessitates market-based transfers, but the economic impacts of specific allocation policies and infrastructure constraints on these transfers are poorly understood.",Research lacked a regional application of large-scale hydroeconomic optimization models to quantify the shadow values and marginal benefits of specific water marketing strategies in southern California. (inferred).,A regional application of the CALVIN model utilizes shadow values and marginal value multipliers to analyze economic benefits and storage constraints for southern California water marketing.,Econ-Engi,Econ-Engi,Economic-Engineering,Econ-Engi,,Not specified,Not specified,Yes,True,10.1061/(ASCE)0733-9496(2002)128:1(21),"Model Alternatives, Conclusions",
1-041,"Bekchanov, M.; Sood, A.; Pinto, A.; Jeuland, M.",2017,2017,2015–2019,Systematic Review of Water-Economy Modeling Applications,ASCE Library,A,Increasing global water scarcity due to population growth and urbanization requires a better understanding of the diverse modeling approaches used to evaluate economic trade-offs in basin management.,"The scientific community lacked a comprehensive systematic review that synthesizes the range, distribution, and research gaps of basin-scale and economywide water-economic models across different sectors.","This review provides a new synthesis of 160 hydroeconomic model applications, identifying critical gaps in the water-energy-food nexus and the need for multidisciplinary nonmarket valuation.",Review,Other,Review/Theoretical,Review,,Not specified,Not specified,,False,10.1061/(ASCE)WR.1943-5452.0000793,"Intro, Research Challenges",
1-042,"Guan, Z.; Shawwash, Z.; Abdalla, A.",2018,2018,2015–2019,Using SDDP to Develop Water-Value Functions for a Multireservoir System with International Treaties,ASCE Library,A,"Multireservoir hydroelectric systems like BC Hydro face high complexity in scheduling when considering stochastic seasonal inflows, load requirements, and international treaty storage obligations simultaneously.",Operational planning lacked a robust algorithm to generate monthly water-value functions that globally optimize storage accounts while accounting for seasonal volume forecasts in a multistate setting.,A novel algorithm using SDDP generates monthly water-value functions by combining Benders cuts to approximate future value for operable storage ranges in complex multireservoir systems.,SDDP,SDDP,Optimization,SDDP,,Not specified,Not specified,,False,10.1061/(ASCE)WR.1943-5452.0000858,"Intro, Conclusions",
1-043,"Zhu, M.; Wu, F.; Shen, J.; Bi, F.",2021,2021,2020–2025,Water Rights Trading Application to Water-Rich Regions in Southern China,ASCE Library,A,,,,Input-Output,Other,Economic-Engineering,Input-Output,,Not specified,Not specified,Yes,True,10.1061/(ASCE)WR.1943-5452.0001435,,
1-044,"Shawwash, Z. K.; Siu, T. K.; Russell, S. O.",1999,1999,Pre-2000,A Decision Support System for Short Term Hydropower Scheduling and Reservoir Management in a Competitive Market,ASCE Library,A,Hydroelectric operators require real-time advice to make optimal trade-offs between current revenues from spot energy transactions and the potential long-term value of water stored in reservoirs.,Existing short-term tools lacked an integrated linear programming framework capable of meeting domestic firm loads while maximizing export revenues based on marginal water values. (inferred).,A short-term optimization model using linear programming and CPLEX provides accurate advice for operating hydroelectric facilities up to one week ahead in a competitive market.,LP,LP,Optimization,LP,,Not specified,Not specified,,False,10.1061/40430(1999)248,"Optimization Model, Conclusions",
1-045,"Teasley, R.; Raffensperger, J.; Milke, M.",2010,2010,2010–2014,A Smart Market for Ground and Surface Water with Hydropower Generation,ASCE Library,C,Groundwater depletion and environmental damage require efficient allocation mechanisms to protect sensitive areas from over-pumping and mismanagement of combined groundwater and surface water resources.,Existing water management tools fail to easily reallocate water between users due to high transaction costs and complex interactions between groundwater and surface water.,A periodic auction smart market uses an optimization model and simulation to efficiently allocate integrated groundwater and surface water based on user bids.,LP,LP,Optimization,LP,,Not specified,Not specified,,False,10.1061/41114(371)112,"Abstract, Intro",
1-046,"Enright, C.; Lund, J. R.",1991,1991,Pre-2000,Alternative Water‐District Organization: Screening‐Level Analysis,ASCE Library,R,Policy makers need to evaluate alternative regional water-resource policies and intradistrict transfers without requiring excessively complex models or unavailable detailed hydrologic data.,Existing interregional trade models often use nonlinear demand functions that distort results or fail to examine inflow variability across different water-district organizational scenarios.,A screening-level spatial equilibrium model employs linear demand functions and lifeline constraints to evaluate eight water-apportionment scenarios under varying hydrologic regimes.,,Not available,Not available,Not available,"California, US",United States,North America,,False,10.1061/(ASCE)0733-9496(1991)117:1(86),"Screening-Level Analysis, results",
