ID,Authors,Year,Year_numeric,Decade,Title,Search engine,Classification,Problem_statement,Research_gap,Contribution,Method,Method_clean,Method_category,Method_detail,Study region,Study_region_clean,Study_region_continent,Numerical water value,Has_water_value,DOI,Extraction_source,Notes
1-201,"Kumar, R.; Kumar, A.",2015,2015,2015–2019,Real and Reactive Power Pricing with Hydro Condenser in Pool Based Electricity Market Model,Scopus,C,"Maintaining real and reactive power balance at system buses is essential for grid stability, requiring precise injection modeling for varied generation technologies.","Simplified load flow models often ignore reactive power flow and bus voltage injections, leading to inaccurate representations of hydrothermal system operational costs. (inferred).",A power flow model uses bus-level injection equations and cost functions to optimize the real and reactive power balance in integrated power grids.,Other,Other,Other,Other,India,India,Asia/Oceania,,False,10.1109/CSNT.2015.54,"Nomenclature, Bus Injection",
1-202,"Skytte, K.; Olsen, O. J.",2016,2016,2015–2019,Regulatory barriers for flexible coupling of the Nordic power and district heating markets,IEEE Xplore,C,Outdated policies and regulatory frameworks create barriers that prevent the effective use of district heating as a flexibility resource for integrating wind energy.,Existing research lacks a detailed investigation of the barriers preventing the substitution of heat-only boilers with flexible combined heat and power plants in Denmark.,A survey paper identifies regulatory and economic barriers to using district heating for electricity market flexibility and provides recommendations for policy reform.,Other,Other,Other,Other,,Not specified,Not specified,,False,10.1109/EEM.2016.7521319,"Abstract, Intro",
1-203,"Cleto, J.; Simoes, S.; Fortes, P.; Seixas, J.",2008,2008,2005–2009,Renewable energy sources availability under climate change scenarios &#x2014; Impacts on the Portuguese energy system,IEEE Xplore,C,Energy systems must be designed to satisfy demand at the lowest possible cost while adhering to strict environmental policy constraints and emission limits.,"There is a need for integrated models that can jointly evaluate installed capacity, primary energy flows, and final prices under varied technology subsidy scenarios. (inferred).",The TIMES_PT optimization model determines the lowest-cost combination of energy supply and demand technologies while satisfying primary energy and material flow constraints.,LP,LP,Optimization,LP,,Not specified,Not specified,,False,10.1109/EEM.2008.4579074,"Abstract, Intro",
1-204,"Su, L.; Nan, H.; Yu, X.; Wu, L.; Li, N.",2010,2010,2010–2014,Research on the Cost Analysis System of Hydropower Ancillary Services Based on LabVIEW,IEEE Xplore,D,Efficient and fair cost allocation for spinning reserves is critical in maintaining system reliability within competitive electricity market environments. (inferred).,Existing scientific literature requires improved methodologies for allocating the costs of ancillary services like spinning reserves to market participants. (inferred).,A novel method for the cost allocation of spinning reserves improves fairness and efficiency within an electricity market environment. (inferred).,Other,Other,Other,Other,,Not specified,Not specified,,False,10.1109/ICIECS.2010.5678337,References,
1-206,"Conejo, A.; Arroyo, J.; Contreras, J.; Villamor, F.",2002,2002,2000–2004,Self-scheduling of a hydro producer in a pool-based electricity market,IEEE Xplore,B,Hydropower companies with cascaded plants must optimize daily self-scheduling to maximize profits while respecting complex spatial-temporal coupling and reservoir head dependencies.,"Previous self-scheduling models often ignored the nonlinear dependence between head, discharge, and power, or failed to precisely model start-up wear and tear costs.",A 0/1 mixed-integer linear programming model incorporates discretized Hill charts to accurately account for head variations and turbine start-up costs.,MILP,MILP,Optimization,MILP,,Not specified,Not specified,,False,10.1109/TPWRS.2002.804951,"Abstract, Intro, Conclusions",
1-207,"Cerjan, M.; Marcic, D.; Delimar, M.",2011,2011,2010–2014,Short term power system planning with water value and energy trade optimisation,IEEE Xplore,A,Optimal hydro scheduling in real systems must account for technical characteristics and socio-economic limitations while accurately forecasting electricity consumption to maintain reservoir levels and water values.,"Practical models lacked an integrated visual framework to correlate planned reservoir levels, inflows, and water values against EPEX prices for efficient short-term generation and exchange scheduling. (inferred).",A scheduling model integrates short-term load forecasting and technical system parameters to optimize reservoir levels and water values relative to market consumption and exchange demands.,LP,LP,Optimization,LP,,Not specified,Not specified,Yes,True,10.1109/EEM.2011.5953022,"Intro, Figure 1",
1-208,"Xiaoyun, H.; Andi, H.; Jingpeng, S.",2019,2019,2015–2019,Short-term Hydro Power Scheduling under the Electricity Market Environment,IEEE Xplore,A,Pump-storage hydropower generators need a practical tool for scheduling and bidding in deregulated electricity markets to stay optimal as new information on prices or inflows arrives.,"The field lacked a practical, hourly scheduling method for pump-storage plants that efficiently handles cyclic efficiency and upper reservoir capacity constraints within a weekly planning period. (inferred).",A practical scheduling and bidding method for pump-storage hydro plants optimizes weekly generation and total profit based on real data from the European Power Exchange.,LP,LP,Optimization,LP,,Not specified,Not specified,Yes,True,10.1109/IICSPI48186.2019.9095949,"Conclusion, Sec IV",
1-209,"Fosso, O.; Belsnes, M.",2004,2004,2000–2004,Short-term hydro scheduling in a liberalized power system,IEEE Xplore,R,Systems with significant reservoir storage require short-term scheduling that is coupled with long-term strategic decisions to ensure consistent and strategic utilization of hydropower resources.,"It is computationally infeasible to include detailed online operational constraints in long-term models, necessitating a flexible coupling principle that maintains consistency across a planning hierarchy.",A solution based on successive linear programming proposes a flexible coupling principle between mid-term scheduling and detailed short-term models for large hydropower systems.,Theoretical,Other,Review/Theoretical,Theoretical,,Not specified,Not specified,,False,10.1109/ICPST.2004.1460206,"Intro, Coupling to Midterm",
1-210,"Eusebio, E.; Camus, C.; Mendes, V.",2011,2011,2010–2014,Short-term value for the water stored in head-sensitivity power system reservoirs,IEEE Xplore,A,Pure linear approaches fail to capture the economic value of water in head-sensitive reservoirs with small storage capacities where hydro plant efficiency is heavily dependent on water level.,Deterministic approaches lacked a quadratic programming formulation to obtain water values from Lagrange multipliers that specifically account for head-sensitivity in tree-cascaded reservoir configurations. (inferred).,"A deterministic approach using quadratic programming computes short-term water values for head-sensitive reservoirs, emphasizing the role of stored water as a scarce resource with sensitivity-derived economic value.",NLP,Other,Optimization,NLP,,Not specified,Not specified,Yes,True,10.1109/EEM.2011.5953023,"Intro, Sec III",
1-211,"Belsnes, M. M.; Warland, G.; Wolfgang, O.",2011,2011,2010–2014,Simulating equilibrium prices in oligopoly power markets,IEEE Xplore,A,Exercise of market power in hydropower systems is difficult to reveal because the supply-side resource is inherently stochastic and transmission bottlenecks can create localized price distortions.,Market simulators lacked an extension capable of evaluating price establishment in systems using zonal pricing where transmission limits often prevent treating the power market as a single area. (inferred).,A method for simulating price establishment in zonal pricing systems uses a discrete staircase-type bidding approach to evaluate market power and efficiency in the NordPool system.,Econ-Engi,Econ-Engi,Economic-Engineering,Econ-Engi,,Not specified,Not specified,Yes,True,10.1109/PTC.2011.6019238,"Intro, Sec C",
1-212,"Dong, X.; Hu, T.; Li, X.",2012,2012,2010–2014,Simulating Power Supplier's Behavior in Electricity Market,IEEE Xplore,D,Electricity markets are often oligopolistic where strategic bidding by power suppliers affects price stability and increases market design risks.,Standard models of perfect rationality are too strict to accurately describe the bounded rationality and learning processes of power suppliers.,A simulation model using game learning theory describes the learning behavior of bounded rationality agents to test electricity market designs.,Econ-Engi,Econ-Engi,Economic-Engineering,Econ-Engi,,Not specified,Not specified,,False,10.1109/ISCID.2012.104,Intro,
1-213,"Forouzandehmehr, N.; Han, Z.; Zheng, R.",2016,2016,2015–2019,Stochastic Dynamic Game between Hydropower Plant and Thermal Power Plant in Smart Grid Networks,IEEE Xplore,R,Increasing demand for pollution-free energy requires energy storage to balance supply and demand and mitigate uncertainties in the electricity market.,Standard power system studies lacked an evaluation of the interaction between thermal plants and large-scale pumped-storage hydropower plants using stochastic differential game theory (inferred).,A survey of game-theoretic methods and smart grid efforts identifies the role of pumped-storage hydropower plants in balancing market supply and demand.,Econ-Engi,Econ-Engi,Economic-Engineering,Econ-Engi,,Not specified,Not specified,,False,10.1109/JSYST.2014.2317555,"Intro, References",
1-214,"Abgottspon, H.; Andersson, G.",2013,2013,2010–2014,Stochastic scheduling for a price-maker hydro producer considering forward trading,IEEE Xplore,A,Price-maker hydro producers with pumping capabilities face computational intractability when trying to solve strategic self-scheduling problems involving hourly bidding and forward contracts over a one-year horizon.,Previous self-scheduling models lacked a multi-stage stochastic program that assumes linear price-amount dependencies to remain tractable while calculating water values and optimal forward contract bids. (inferred).,A multi-stage stochastic programming model solves the bidding problem for price-maker hydro plants by estimating water values and profits through integrated hourly recourse actions and forward contracts.,SDP,SDP,Optimization,SDP,,Not specified,Not specified,Yes,True,10.1109/PTC.2013.6652304,"Intro, Sec II",
1-215,"Moiseeva, E.; Hesamzadeh, M. R.",2015,2015,2015–2019,Strategic bidding by a risk-averse firm with a portfolio of renewable resources,IEEE Xplore,G,Strategic firms owning flexible renewable resources like hydropower and storage can potentially abuse market power by withholding ramp-rates to manipulate electricity prices during periods of uncertainty.,Existing MPEC models need extension to stochastic setups that consider risk-aversion through CVaR and model the effects of withholding ramp-rate on social welfare and profits.,A bi-level stochastic MPEC recast as a single-stage MILP investigates the effect of strategic ramp-rate bidding by risk-averse companies owning varied renewable portfolios.,Econ-Engi,Econ-Engi,Economic-Engineering,Econ-Engi,,Not specified,Not specified,,False,10.1109/PTC.2015.7232550,"Abstract, Intro",
1-216,"Campos, F. A.; Munoz San Roque, A.; Sanchez-Ubeda, E. F.; Portela Gonzalez, J.",2016,2016,2015–2019,Strategic Bidding in Secondary Reserve Markets,IEEE Xplore,C,Companies face technical and financial risks when preparing step-wise secondary reserve bidding curves in the very short term under significant market uncertainty.,"Related literature often fails to consider different power limits for regulating plants, which can lead to bidding curves that cause significant profit losses.",A mixed-integer programming model computes robust secondary reserve bidding curves by considering technical constraints and Multilayer Perceptron-based residual demand curve forecasts.,MIP,MILP,Optimization,MIP,,Not specified,Not specified,,False,10.1109/TPWRS.2015.2453477,"Abstract, Conclusion",
1-217,"Abgottspon, H.; Andersson, G.",2013,2013,2010–2014,Strategic bidding of ancillary services for a hydro power producer,IEEE Xplore,A,Agents in secondary control power markets must repeatedly adjust bids based on shared knowledge and water values to optimize expected profits across thousands of game rounds.,The secondary control market lacked an iterative algorithm that shares repetitive knowledge among agents to converge on optimal bids while accounting for specific water values and plant characteristics. (inferred).,An iterative parallel algorithm uses shared knowledge and CPLEX to calculate optimal secondary control power bids for agents based on carefully estimated water values and profit functions.,SDP,SDP,Optimization,SDP,,Not specified,Not specified,,False,10.1109/EEM.2013.6607360,"Nomenclature, Sec IV",
1-218,"Alnaes, E. N.; Grondahl, R.; Fleten, S.; Boomsma, T. K.",2013,2013,2010–2014,The degree of rationality in actual bidding of hydropower at Nord Pool,IEEE Xplore,C,Flexible hydropower producers often exhibit sub-optimal bidding behavior in day-ahead markets due to complex regulations on water flows and variable fees.,Empirical analysis of individual producer bidding behavior is scarce compared to normative optimization approaches or studies focused solely on market power abuse.,An empirical study analyzes actual day-ahead bids to identify underlying factors and quantifies the maximum potential income increase for flexible hydropower producers.,Other,Other,Other,Other,,Not specified,Not specified,,False,10.1109/EEM.2013.6607389,"Intro, Methodology",
1-219,"Pereira, J. P.; Pesquita, V.; Rodrigues, P. M. M.",2017,2017,2015–2019,The effect of hydro and wind generation on the mean and volatility of electricity prices in Spain,IEEE Xplore,G,"The increasing penetration of wind and solar capacity, alongside variable reservoir levels, creates potential structural breaks in how renewables influence electricity spot-market price level and variance.",Empirical evidence is needed to determine the specific stabilizing effect of reservoir levels on intraday power prices when facing significant wind forecast errors in large systems.,An ARX-GARCHX model estimates the impact of wind generation and hydro reservoir levels on Spanish day-ahead prices across different sub-periods and structural breaks.,Econ-Engi,Econ-Engi,Economic-Engineering,Econ-Engi,,Not specified,Not specified,,False,10.1109/EEM.2017.7981915,"Sub-period analysis, Refs",
1-220,"Aigner, T.; Jaehnert, S.; Doorman, G. L.; Gjengedal, T.",2012,2012,2010–2014,The Effect of Large-Scale Wind Power on System Balancing in Northern Europe,IEEE Xplore,G,Integrating large-scale wind power requires additional regulating reserves and higher flexibility from thermal plants to compensate for production deviations and prediction errors at any instance.,Market participants need a better understanding of how procuring and activating regulating reserves in real-time affects the overall efficiency of liberalized northern European power markets (inferred).,A modeling framework analyzes integrated regulating power markets in Europe to evaluate the benefits of transmission capacity reservation for exchanging regulating resources under wind uncertainty.,SDP,SDP,Optimization,SDP,,Not specified,Not specified,,False,10.1109/TSTE.2012.2203157,"Intro, Refs",
1-221,"Hankimaa, H.; Oliveira, F.; Fanzeres, B.",2025,2025,2020–2025,The Effect of Multi-Market Participation on Day-Ahead Trading of an Electricity Producer,IEEE Xplore,C,Power generating companies with hybrid portfolios of dispatchable and renewable energy must manage significant revenue risks from imbalances across sequential electricity markets.,Existing models that constrain expected imbalances to zero are often unsuitable for portfolios containing variable renewable energy generators due to inherent uncertainty.,A stochastic optimization model uses a multistage scenario tree to decide optimal offer curves for day-ahead and reserve markets while managing imbalances.,SP,Other,Optimization,SP,,Not specified,Not specified,,False,10.1109/EEM64765.2025.11050191,"Abstract, Conclusion",
1-222,"Nacken, L.; Mobius, T.",2017,2017,2015–2019,The effects of harmonized European climate policy targets in comparison to national targets utilizing a European electricity market model,IEEE Xplore,D,Inefficiencies in achieving climate policy targets occur when nations have different marginal generation costs for renewables and emission abatement.,"There is a lack of analysis comparing fully harmonized EU-wide climate goals against decentralized, country-specific renewable and emission targets. (inferred).",A fundamental electricity market investment and dispatch model evaluates the economic efficiency and electricity price impacts of harmonized European climate targets.,LP,LP,Optimization,LP,,Not specified,Not specified,,False,10.1109/EEM.2017.7981987,"Intro, Sec II",
1-224,"Eriksen, M.; Trondal, M. E.",2022,2022,2020–2025,The Influence on Day-Ahead Trading Volumes by Including Power Flow Equations in The Planning Algorithm for Short-Term Hydropower in Congested Areas,IEEE Xplore,C,"Increasing penetration of renewable sources creates bottlenecks and price differences between zones, requiring tools that explicitly model meshed network topology.","Previous short-term hydropower scheduling studies have investigated grid issues in a simplified radial manner, neglecting the complex dynamics of meshed networks.",A multi-period optimal power flow algorithm combined with short-term hydropower scheduling evaluates how storage dynamics and grid restrictions influence nodal area prices.,LP,LP,Optimization,LP,,Not specified,Not specified,,False,10.1109/EEM54602.2022.9921169,"Intro, Formulation",
1-225,"Vardanyan, Y.; Amelin, M.",2011,2011,2010–2014,The state-of-the-art of the short term hydro power planning with large amount of wind power in the system,Scopus,R,"Large-scale introduction of wind power introduces significant variations and uncertainties into the power market, requiring advanced hydropower planning techniques to provide flexibility.","Existing stochastic models for short-term hydropower planning typically reflect only one type of uncertainty rather than addressing multiple types, such as market prices and inflows, simultaneously.",A state-of-the-art review categorizes short-term hydropower planning models and identifies the need for multi-stage stochastic models that incorporate multiple types of uncertainty.,Review,Other,Review/Theoretical,Review,,Not specified,Not specified,,False,10.1109/EEM.2011.5953053,"Abstract, Intro, Conclusion",
1-226,"Kjetsa, E. S.; Kjetsa, E. S.; Mo, B.",2015,2015,2015–2019,The value of considering uncertain fuel prices in the profitability evaluation of future HVDC links between the Nordic system and continental Europe,IEEE Xplore,R,"Hydropower scheduling optimization traditionally assumes fuel prices are deterministic, failing to find strategies that are robust with respect to significant fuel price variations.","Standard stochastic dynamic programming (then ""SDP"") solution methods are limited by the curse of dimensionality, restricting the state variables available for price modeling in market clearing problems.",A theoretical modeling approach includes fuel price uncertainties in water value calculations to increase the benefit of interconnections and shift energy trade to more beneficial times.,SDP,SDP,Optimization,SDP,,Not specified,Not specified,,False,10.1109/EEM.2015.7216699,"Intro, SDP section, Conclusions",
1-227,"Farinosi, F.; Carrera, L.; Mysiak, J.; Breil, M.; Testella, F.",2012,2012,2010–2014,Tradable certificates for renewable energy: The Italian experience with hydropower,IEEE Xplore,G,Sustainable water management in Europe requires effective economic policy instruments to mitigate the hydrologic impacts of hydropower stations and other carbon-neutral energy developments.,Comprehensive documentation and assessment of subsidies for ecologically friendly hydropower plants and the resulting consequences for basin-level water balance are missing from cross-border policy analysis (inferred).,The EPI-WATER project report synthesizes case studies on Italian and German renewable certificates and subsidies to evaluate their effectiveness for sustainable water and energy management.,Theoretical,Other,Review/Theoretical,Theoretical,,Not specified,Not specified,,False,10.1109/EEM.2012.6254695,"Acknowledgment, Refs",
1-228,"Toma, L.; Urluescu, L.; Eremia, M.; Revaz, J.",2007,2007,2005–2009,Trading Ancillary Services for Frequency Regulation in Competitive Electricity Markets,IEEE Xplore,D,Transmission system operators must define clear technical codes and operational procedures for qualifying suppliers of balancing energies and ancillary services. (inferred).,Methodological voids exist regarding the selection and qualification processes for different types of balancing energies in national transmission networks. (inferred).,A set of operational procedures and technical codes defines the qualification and selection criteria for ancillary service providers in a power system. (inferred).,LP,LP,Optimization,LP,,Not specified,Not specified,,False,10.1109/PCT.2007.4538431,References,
1-229,"Braun, S. M.; Burkhardt, M.",2015,2015,2015–2019,Trading of pumped storage hydropower plants on energy only and ancillary services markets,IEEE Xplore,F,Hydropower storage operators must maximize profits by coordinating turbine and pump use across different electricity market stages and target reservoir levels. (inferred).,Methodologies for optimizing hydroelectric systems under spot and control energy market prices require more comprehensive stochastic representations. (inferred).,A profit maximization model for hydropower systems optimizes turbine and pump operations using market prices and reservoir filling levels. (inferred).,LP,LP,Optimization,LP,,Not specified,Not specified,,False,10.1109/ICRERA.2015.7418492,Nomenclature,
1-232,"Duc, D. X.; Singh, J. G.; Ongsakul, W.",2011,2011,2010–2014,Water valuation in Vietnamese electric power generation market,IEEE Xplore,A,Managing saved water for future use in hydro-thermal systems requires substantially accurate water value calculations that can account for transmission constraints and stochastic inflow variables.,Systems modeling lacked a solution algorithm that effectively applies stochastic dual dynamic programming to large-scale hydro-thermal optimization while maintaining technical and transmission accuracy. (inferred).,This work suggests using the SDDP method as a solution algorithm to execute substantial water value calculations and optimize stochastic hydro-thermal power systems with transmission constraints.,SDDP,SDDP,Optimization,SDDP,,Not specified,Not specified,Yes,True,10.1109/ICUEPES.2011.6497713,Excerpt,
1-233,"Helseth, A.; Mo, B.; Fodstad, M.",2017,2017,2015–2019,Water values in future power markets,Scopus,A,"Hydropower valuation is significantly affected when considering multiple balancing markets, yet including all reserve capacity and energy markets in weekly scheduling models is an exhaustive computational task.",Scheduling models lacked a framework to find how water valuation is precisely affected by the inclusion of reserve capacity procurement and balancing energy within a multi-market setting. (inferred).,"A multi-market scheduling model evaluates how the valuation of water is affected by balancing markets, considering uncertainties in inflows and prices over three to five-year analysis periods.",LP,LP,Optimization,LP,,Not specified,Not specified,Yes,True,10.1109/PTC.2017.7980885,Excerpt,
1-234,"Figueiredo, N. C.; Pereira Da Silva, P.; Cerqueira, P.",2015,2015,2015–2019,Wind generation influence on market splitting: The Iberian spot electricity market,IEEE Xplore,D,"High deployment of wind and hydropower can create grid congestion and market splitting, challenging the management of cross-border interconnections.",Previously used parametric models have known limitations and fail to provide sufficient detail on market splitting probability responses.,"Non-parametric models express the probability of market splitting as a function of wind power, hydropower, available transmission capacity, and demand.",Non-parametric,Other,Economic-Engineering,Non-parametric,,Not specified,Not specified,,False,10.1109/EEM.2015.7216649,"Abstract, Sec VI",
1-235,"Aminabadi, M. J.; Séguin, S.; Fleten, S.; Aasgård, E. K.",2025,2025,2020–2025,Optimizing Profile Block Bids in Short-Term Hydropower Scheduling: A Two-Phase Model for the Day-Ahead Market,IEEE Xplore,C,Producers with cascaded reservoirs must navigate complex intertemporal dependencies and conflicts between upstream and downstream water releases when bidding in day-ahead markets.,"While regular block bidding is well-researched, there is a lack of contributions addressing profiled block bids for Norwegian day-ahead market participation.",A two-phase optimization model generates feasible production profiles and then selects the most profitable blocks using a two-stage linear stochastic program.,,Not available,Not available,Not available,Simulated,Synthetic/Theoretical,Not applicable,,False,10.1109/CoDIT66093.2025.11321880,"Intro, Methodology",
